<?xml version="1.0" encoding="UTF-8"?>

<smartGrid
xmlns:xsi="http://www.w3.org/2001/XMLSchema-instance"
xsi:noNamespaceSchemaLocation="SmartGridTemplate.xsd">
    <template>
        <structure>
            <name>Coal Power Plant</name>
            <id>-1</id>
            <type>POWER_PLANT</type>
            <image>POWER_PLANT_IMAGE</image>
            <numberOfUnits>1</numberOfUnits>
            <properties>
                <property>
                    <name>X Coordinate</name>
                    <value type="INTEGER">0</value>
                    <units> </units>
                </property>
                <property>
                    <name>Y Coordinate</name>
                    <value type="INTEGER">0</value>
                    <units> </units>
                </property>
                <property>
                    <name>Emission Rate</name>
                    <value type="DOUBLE">600.0</value>
                    <units>g/kWh</units>
                </property>
                <property>
                    <name>Production Cost</name>
                    <value type="DOUBLE">0.06</value>
                    <units>$/kWh</units>
                </property>
                <property>
                    <name>Capacity</name>
                    <value type="DOUBLE">4000.0</value>
                    <units>W</units>
                </property>
            </properties>
            <appliances/>
            <energySources/>
            <energyStorageDevices/>
        </structure>
        <structure>
            <name>Solar Farm</name>
            <id>-1</id>
            <type>POWER_PLANT</type>
            <image>POWER_PLANT_IMAGE</image>
            <numberOfUnits>1</numberOfUnits>
            <properties>
                <property>
                    <name>X Coordinate</name>
                    <value type="INTEGER">0</value>
                    <units> </units>
                </property>
                <property>
                    <name>Y Coordinate</name>
                    <value type="INTEGER">0</value>
                    <units> </units>
                </property>
                <property>
                    <name>Emission Rate</name>
                    <value type="DOUBLE">100.0</value>
                    <units>g/kWh</units>
                </property>
                <property>
                    <name>Production Cost</name>
                    <value type="DOUBLE">0.5</value>
                    <units>$/kWh</units>
                </property>
                <property>
                    <name>Capacity</name>
                    <value type="DOUBLE">1000.0</value>
                    <units>W</units>
                </property>
            </properties>
            <appliances/>
            <energySources/>
            <energyStorageDevices/>
        </structure>
        <structure>
            <name>Summer Home</name>
            <id>-1</id>
            <type>SINGLE_UNIT</type>
            <image>HOUSE_IMAGE</image>
            <numberOfUnits>1</numberOfUnits>
            <properties>
                <property>
                    <name>X Coordinate</name>
                    <value type="INTEGER">0</value>
                    <units> </units>
                </property>
                <property>
                    <name>Y Coordinate</name>
                    <value type="INTEGER">0</value>
                    <units> </units>
                </property>
            </properties>
            <appliances>
                <device>
                    <name>Portable Fan</name>
                    <id>-1</id>
                    <type>APPLIANCE</type>
                    <properties>
                        <property>
                            <name>Standby Consumption</name>
                            <value type="DOUBLE">0.0</value>
                            <units>W</units>
                        </property>
                        <property>
                            <name>Usage Consumption</name>
                            <value type="DOUBLE">115.0</value>
                            <units>W</units>
                        </property>
                    </properties>
                    <timeSpans>
                        <timeSpan>
                            <from>61200.0</from>
                            <to>72000.0</to>
                        </timeSpan>
                    </timeSpans>
                </device>
                <device>
                    <name>Continuous Furnace Fan Motor</name>
                    <id>-1</id>
                    <type>APPLIANCE</type>
                    <properties>
                        <property>
                            <name>Standby Consumption</name>
                            <value type="DOUBLE">0.0</value>
                            <units>W</units>
                        </property>
                        <property>
                            <name>Usage Consumption</name>
                            <value type="DOUBLE">350.0</value>
                            <units>W</units>
                        </property>
                    </properties>
                    <timeSpans>
                        <timeSpan>
                            <from>0.0</from>
                            <to>86340.0</to>
                        </timeSpan>
                    </timeSpans>
                </device>
                <device>
                    <name>Central Air Conditioning</name>
                    <id>-1</id>
                    <type>APPLIANCE</type>
                    <properties>
                        <property>
                            <name>Standby Consumption</name>
                            <value type="DOUBLE">0.0</value>
                            <units>W</units>
                        </property>
                        <property>
                            <name>Usage Consumption</name>
                            <value type="DOUBLE">3500.0</value>
                            <units>W</units>
                        </property>
                    </properties>
                    <timeSpans>
                        <timeSpan>
                            <from>43200.0</from>
                            <to>68400.0</to>
                        </timeSpan>
                    </timeSpans>
                </device>
                <device>
                    <name>Dishwasher</name>
                    <id>-1</id>
                    <type>APPLIANCE</type>
                    <properties>
                        <property>
                            <name>Standby Consumption</name>
                            <value type="DOUBLE">0.0</value>
                            <units>W</units>
                        </property>
                        <property>
                            <name>Usage Consumption</name>
                            <value type="DOUBLE">1300.0</value>
                            <units>W</units>
                        </property>
                    </properties>
                    <timeSpans>
                        <timeSpan>
                            <from>70200.0</from>
                            <to>72000.0</to>
                        </timeSpan>
                    </timeSpans>
                </device>
                <device>
                    <name>Fridge</name>
                    <id>-1</id>
                    <type>APPLIANCE</type>
                    <properties>
                        <property>
                            <name>Standby Consumption</name>
                            <value type="DOUBLE">0.0</value>
                            <units>W</units>
                        </property>
                        <property>
                            <name>Usage Consumption</name>
                            <value type="DOUBLE">500.0</value>
                            <units>W</units>
                        </property>
                    </properties>
                    <timeSpans>
                        <timeSpan>
                            <from>25200.0</from>
                            <to>30600.0</to>
                        </timeSpan>
                        <timeSpan>
                            <from>43200.0</from>
                            <to>50400.0</to>
                        </timeSpan>
                        <timeSpan>
                            <from>66600.0</from>
                            <to>72000.0</to>
                        </timeSpan>
                    </timeSpans>
                </device>
                <device>
                    <name>Television</name>
                    <id>-1</id>
                    <type>APPLIANCE</type>
                    <properties>
                        <property>
                            <name>Standby Consumption</name>
                            <value type="DOUBLE">0.0</value>
                            <units>W</units>
                        </property>
                        <property>
                            <name>Usage Consumption</name>
                            <value type="DOUBLE">100.0</value>
                            <units>W</units>
                        </property>
                    </properties>
                    <timeSpans>
                        <timeSpan>
                            <from>61200.0</from>
                            <to>82800.0</to>
                        </timeSpan>
                    </timeSpans>
                </device>
                <device>
                    <name>Stove</name>
                    <id>-1</id>
                    <type>APPLIANCE</type>
                    <properties>
                        <property>
                            <name>Standby Consumption</name>
                            <value type="DOUBLE">0.0</value>
                            <units>W</units>
                        </property>
                        <property>